resId,rating,date,descreption,gId
506,1,29/08/2025,"nibh. Phasellus nulla. Integer vulputate, risus a ultricies adipiscing, enim",950
796,1,08/04/2025,"magna. Lorem ipsum dolor sit amet, consectetuer adipiscing elit. Etiam",939
687,8,11/11/2024,Mauris nulla. Integer urna. Vivamus molestie dapibus ligula. Aliquam erat,545
392,9,08/05/2024,iaculis odio. Nam interdum enim non nisi. Aenean eget metus.,593
68,4,02/10/2024,"eget varius ultrices, mauris ipsum porta elit, a feugiat tellus",355
997,9,24/09/2024,"lectus convallis est, vitae sodales nisi magna sed dui. Fusce",53
953,7,09/06/2024,"ultricies adipiscing, enim mi tempor lorem, eget mollis lectus pede",184
658,1,02/07/2024,"consectetuer, cursus et, magna. Praesent interdum ligula eu enim. Etiam",736
417,6,27/12/2024,lorem tristique aliquet. Phasellus fermentum convallis ligula. Donec luctus aliquet,758
338,2,04/02/2025,Maecenas ornare egestas ligula. Nullam feugiat placerat velit. Quisque varius.,534
438,7,26/07/2024,gravida. Praesent eu nulla at sem molestie sodales. Mauris blandit,939
274,8,08/06/2025,eros non enim commodo hendrerit. Donec porttitor tellus non magna.,249
189,6,12/11/2024,"vel, vulputate eu, odio. Phasellus at augue id ante dictum",311
904,1,27/11/2025,"et risus. Quisque libero lacus, varius et, euismod et, commodo",386
404,3,19/04/2025,Aliquam rutrum lorem ac risus. Morbi metus. Vivamus euismod urna.,902
91,3,12/08/2025,"dapibus id, blandit at, nisi. Cum sociis natoque penatibus et",327
746,7,25/11/2025,"elementum sem, vitae aliquam eros turpis non enim. Mauris quis",314
998,4,30/08/2025,Nullam vitae diam. Proin dolor. Nulla semper tellus id nunc,472
394,4,01/09/2024,"dolor, nonummy ac, feugiat non, lobortis quis, pede. Suspendisse dui.",981
529,3,16/07/2025,"sapien. Cras dolor dolor, tempus non, lacinia at, iaculis quis,",695
131,6,26/03/2025,tincidunt pede ac urna. Ut tincidunt vehicula risus. Nulla eget,952
807,6,22/04/2025,"enim, gravida sit amet, dapibus id, blandit at, nisi. Cum",881
996,8,19/12/2024,"felis, adipiscing fringilla, porttitor vulputate, posuere vulputate, lacus. Cras interdum.",933
90,4,10/08/2025,Sed molestie. Sed id risus quis diam luctus lobortis. Class,645
785,9,21/02/2026,magna et ipsum cursus vestibulum. Mauris magna. Duis dignissim tempor,750
943,10,24/11/2024,"Cras vehicula aliquet libero. Integer in magna. Phasellus dolor elit,",767
98,2,15/12/2025,"aliquet odio. Etiam ligula tortor, dictum eu, placerat eget, venenatis",797
12,7,19/09/2024,"consectetuer adipiscing elit. Etiam laoreet, libero et tristique pellentesque, tellus",843
484,1,20/05/2025,"Donec est mauris, rhoncus id, mollis nec, cursus a, enim.",225
408,8,06/09/2024,"aliquam iaculis, lacus pede sagittis augue, eu tempor erat neque",65
862,4,18/04/2025,Ut nec urna et arcu imperdiet ullamcorper. Duis at lacus.,592
337,10,22/08/2025,eu augue porttitor interdum. Sed auctor odio a purus. Duis,157
251,9,15/05/2025,ligula. Aenean euismod mauris eu elit. Nulla facilisi. Sed neque.,695
149,3,23/11/2025,Nunc quis arcu vel quam dignissim pharetra. Nam ac nulla.,188
998,4,11/11/2024,"risus varius orci, in consequat enim diam vel arcu. Curabitur",750
522,0,19/01/2025,"dolor sit amet, consectetuer adipiscing elit. Curabitur sed tortor. Integer",528
382,8,29/06/2024,"aliquet diam. Sed diam lorem, auctor quis, tristique ac, eleifend",68
226,6,12/10/2024,erat vel pede blandit congue. In scelerisque scelerisque dui. Suspendisse,996
231,7,28/08/2025,"lacinia vitae, sodales at, velit. Pellentesque ultricies dignissim lacus. Aliquam",601
216,1,09/03/2025,"condimentum eget, volutpat ornare, facilisis eget, ipsum. Donec sollicitudin adipiscing",199
651,4,12/11/2025,pede. Cras vulputate velit eu sem. Pellentesque ut ipsum ac,927
635,4,25/05/2024,dictum augue malesuada malesuada. Integer id magna et ipsum cursus,966
579,9,26/08/2025,Aliquam ultrices iaculis odio. Nam interdum enim non nisi. Aenean,159
449,3,26/08/2025,Etiam vestibulum massa rutrum magna. Cras convallis convallis dolor. Quisque,890
100,2,20/10/2024,"rhoncus. Nullam velit dui, semper et, lacinia vitae, sodales at,",170
370,1,03/02/2026,"Maecenas mi felis, adipiscing fringilla, porttitor vulputate, posuere vulputate, lacus.",697
374,2,22/09/2025,"eleifend, nunc risus varius orci, in consequat enim diam vel",683
379,3,01/10/2025,"vitae, posuere at, velit. Cras lorem lorem, luctus ut, pellentesque",975
902,9,10/11/2024,"ac, fermentum vel, mauris. Integer sem elit, pharetra ut, pharetra",11
464,4,04/03/2025,Curae Donec tincidunt. Donec vitae erat vel pede blandit congue.,173
131,8,31/12/2025,"massa. Integer vitae nibh. Donec est mauris, rhoncus id, mollis",852
435,2,30/08/2024,"enim. Suspendisse aliquet, sem ut cursus luctus, ipsum leo elementum",879
111,6,02/11/2025,ante. Vivamus non lorem vitae odio sagittis semper. Nam tempor,17
899,4,24/04/2025,"dolor, tempus non, lacinia at, iaculis quis, pede. Praesent eu",425
788,3,06/10/2025,"accumsan laoreet ipsum. Curabitur consequat, lectus sit amet luctus vulputate,",349
434,9,10/12/2024,"iaculis enim, sit amet ornare lectus justo eu arcu. Morbi",16
306,7,25/10/2024,"vel, vulputate eu, odio. Phasellus at augue id ante dictum",141
763,3,14/12/2025,Cras pellentesque. Sed dictum. Proin eget odio. Aliquam vulputate ullamcorper,819
576,8,19/01/2026,"eu, odio. Phasellus at augue id ante dictum cursus. Nunc",441
171,9,01/10/2025,Nam tempor diam dictum sapien. Aenean massa. Integer vitae nibh.,233
657,6,29/12/2025,"dapibus gravida. Aliquam tincidunt, nunc ac mattis ornare, lectus ante",300
428,3,20/11/2024,"auctor, velit eget laoreet posuere, enim nisl elementum purus, accumsan",525
601,9,22/08/2025,"Maecenas mi felis, adipiscing fringilla, porttitor vulputate, posuere vulputate, lacus.",623
127,1,11/10/2024,quam a felis ullamcorper viverra. Maecenas iaculis aliquet diam. Sed,13
473,8,19/06/2025,in consequat enim diam vel arcu. Curabitur ut odio vel,233
95,6,30/03/2025,"vitae nibh. Donec est mauris, rhoncus id, mollis nec, cursus",111
578,3,22/05/2024,"sociis natoque penatibus et magnis dis parturient montes, nascetur ridiculus",543
385,5,06/04/2024,"Lorem ipsum dolor sit amet, consectetuer adipiscing elit. Curabitur sed",852
525,7,28/02/2026,"fermentum vel, mauris. Integer sem elit, pharetra ut, pharetra sed,",123
564,6,23/01/2025,sit amet orci. Ut sagittis lobortis mauris. Suspendisse aliquet molestie,257
785,3,07/07/2024,"lectus, a sollicitudin orci sem eget massa. Suspendisse eleifend. Cras",166
249,5,01/04/2025,Morbi non sapien molestie orci tincidunt adipiscing. Mauris molestie pharetra,686
891,4,27/01/2025,"orci, in consequat enim diam vel arcu. Curabitur ut odio",310
314,3,07/04/2024,risus. Donec egestas. Duis ac arcu. Nunc mauris. Morbi non,345
2,8,13/06/2024,"sit amet luctus vulputate, nisi sem semper erat, in consectetuer",72
780,1,23/01/2025,nascetur ridiculus mus. Proin vel arcu eu odio tristique pharetra.,615
887,1,27/06/2025,Morbi vehicula. Pellentesque tincidunt tempus risus. Donec egestas. Duis ac,450
242,6,09/07/2024,"mauris ipsum porta elit, a feugiat tellus lorem eu metus.",364
467,4,30/12/2025,"faucibus id, libero. Donec consectetuer mauris id sapien. Cras dolor",797
714,8,31/03/2025,ac turpis egestas. Aliquam fringilla cursus purus. Nullam scelerisque neque,753
217,4,21/05/2024,Suspendisse aliquet molestie tellus. Aenean egestas hendrerit neque. In ornare,525
36,3,19/08/2025,in lobortis tellus justo sit amet nulla. Donec non justo.,995
390,4,01/07/2024,"condimentum eget, volutpat ornare, facilisis eget, ipsum. Donec sollicitudin adipiscing",908
854,4,28/01/2025,placerat velit. Quisque varius. Nam porttitor scelerisque neque. Nullam nisl.,441
819,7,06/10/2024,"commodo ipsum. Suspendisse non leo. Vivamus nibh dolor, nonummy ac,",701
928,1,04/11/2024,Morbi non sapien molestie orci tincidunt adipiscing. Mauris molestie pharetra,492
951,4,14/08/2024,"lacinia mattis. Integer eu lacus. Quisque imperdiet, erat nonummy ultricies",752
523,9,27/02/2026,"lacus. Quisque imperdiet, erat nonummy ultricies ornare, elit elit fermentum",164
921,8,06/12/2024,at pede. Cras vulputate velit eu sem. Pellentesque ut ipsum,196
841,5,16/10/2024,nec luctus felis purus ac tellus. Suspendisse sed dolor. Fusce,402
531,4,06/08/2024,"auctor vitae, aliquet nec, imperdiet nec, leo. Morbi neque tellus,",893
668,5,13/10/2024,odio semper cursus. Integer mollis. Integer tincidunt aliquam arcu. Aliquam,893
288,7,21/06/2025,convallis convallis dolor. Quisque tincidunt pede ac urna. Ut tincidunt,764
134,9,10/05/2024,arcu. Morbi sit amet massa. Quisque porttitor eros nec tellus.,678
907,1,19/08/2024,Quisque nonummy ipsum non arcu. Vivamus sit amet risus. Donec,66
504,6,23/08/2025,"cursus non, egestas a, dui. Cras pellentesque. Sed dictum. Proin",275
942,2,09/08/2025,magna. Cras convallis convallis dolor. Quisque tincidunt pede ac urna.,32
852,2,28/06/2025,mauris a nunc. In at pede. Cras vulputate velit eu,346
435,10,25/11/2024,Vestibulum accumsan neque et nunc. Quisque ornare tortor at risus.,737
186,8,23/05/2025,"Nunc ut erat. Sed nunc est, mollis non, cursus non,",285
979,6,19/01/2025,"odio vel est tempor bibendum. Donec felis orci, adipiscing non,",966
873,10,14/04/2024,"varius et, euismod et, commodo at, libero. Morbi accumsan laoreet",333
386,10,05/08/2024,"turpis. Aliquam adipiscing lobortis risus. In mi pede, nonummy ut,",539
538,0,15/06/2024,"cursus et, eros. Proin ultrices. Duis volutpat nunc sit amet",851
797,3,26/10/2024,"Donec porttitor tellus non magna. Nam ligula elit, pretium et,",956
745,8,01/05/2025,"iaculis, lacus pede sagittis augue, eu tempor erat neque non",316
110,5,22/05/2024,vel arcu eu odio tristique pharetra. Quisque ac libero nec,808
707,8,15/11/2024,posuere cubilia Curae Phasellus ornare. Fusce mollis. Duis sit amet,911
382,5,30/06/2025,"Suspendisse commodo tincidunt nibh. Phasellus nulla. Integer vulputate, risus a",57
